{
  "schemaVersion": 1,
  "pluginId": "trakt-mcp",
  "overview": {
    "path": "docs/pages/index.html",
    "format": "html",
    "mode": "section",
    "selector": "p.lead"
  },
  "examples": [
    {
      "id": "skill-what-to-watch",
      "capability_refs": [
        "skill:what-to-watch"
      ],
      "title": "Recommend from Trakt",
      "input_or_trigger": "Use Trakt to recommend three thoughtful science-fiction movies.",
      "platform": "claude",
      "prerequisites": [
        "Install the plugin or the named standalone skill, and separately enable the Trakt MCP connection. Skills alone do not supply tools or authenticate the server."
      ],
      "expected_behavior": "Select Trakt recommendations with supported genre filters and explain the returned metadata. If asked for recommendations based on all viewing or unseen titles, first traverse every relevant watched-summary page; for recent viewing use the latest 100 events per medium. Report partial coverage and do not imply streaming availability.",
      "sources": [
        {
          "path": "plugins/trakt-mcp/skills/what-to-watch/SKILL.md",
          "format": "markdown",
          "mode": "section",
          "heading_path": [
            "What to watch"
          ]
        },
        {
          "path": "docs/pages/skills.html",
          "format": "html",
          "mode": "section",
          "selector": "article#what-to-watch"
        },
        {
          "path": "docs/pages/skills.html",
          "format": "html",
          "mode": "section",
          "selector": "section:nth-of-type(2)"
        }
      ],
      "evidence": "documented"
    },
    {
      "id": "skill-watching-profile",
      "capability_refs": [
        "skill:watching-profile"
      ],
      "title": "Summarize watched history",
      "input_or_trigger": "Summarize the movies and shows in my watched data.",
      "platform": "claude",
      "prerequisites": [
        "Install the plugin or the named standalone skill, and separately enable the Trakt MCP connection. Skills alone do not supply tools or authenticate the server."
      ],
      "expected_behavior": "Traverse movie and show summary streams separately, following every next_page until each reports has_more: false and next_page: null. Preserve supplied metadata and report partial coverage with a resume page if either stream is incomplete; do not infer viewing hours, streaks, or completion of a show from its summary.",
      "sources": [
        {
          "path": "plugins/trakt-mcp/skills/watching-profile/SKILL.md",
          "format": "markdown",
          "mode": "section",
          "heading_path": [
            "Watching profile"
          ]
        },
        {
          "path": "docs/pages/skills.html",
          "format": "html",
          "mode": "section",
          "selector": "article#watching-profile"
        },
        {
          "path": "docs/pages/skills.html",
          "format": "html",
          "mode": "section",
          "selector": "section:nth-of-type(2)"
        }
      ],
      "evidence": "documented"
    },
    {
      "id": "skill-find-title",
      "capability_refs": [
        "skill:find-title"
      ],
      "title": "Disambiguate a title",
      "input_or_trigger": "Find the original Solaris, not the remake.",
      "platform": "claude",
      "prerequisites": [
        "Install the plugin or the named standalone skill, and separately enable the Trakt MCP connection. Skills alone do not supply tools or authenticate the server."
      ],
      "expected_behavior": "Search by title and medium, compare returned years and identifiers, and ask which match is intended if the results remain ambiguous. Ordinary lookup stays bounded; an explicit all-results request follows every page.",
      "sources": [
        {
          "path": "plugins/trakt-mcp/skills/find-title/SKILL.md",
          "format": "markdown",
          "mode": "section",
          "heading_path": [
            "Find a movie or show"
          ]
        },
        {
          "path": "docs/pages/skills.html",
          "format": "html",
          "mode": "section",
          "selector": "article#find-title"
        },
        {
          "path": "docs/pages/skills.html",
          "format": "html",
          "mode": "section",
          "selector": "section:nth-of-type(2)"
        }
      ],
      "evidence": "documented"
    },
    {
      "id": "skill-lists-and-watchlist",
      "capability_refs": [
        "skill:lists-and-watchlist"
      ],
      "title": "Create a private list",
      "input_or_trigger": "Create a private list called Rainy Sunday and add Arrival (2016).",
      "platform": "claude",
      "prerequisites": [
        "Install the plugin or the named standalone skill, and separately enable the Trakt MCP connection. Skills alone do not supply tools or authenticate the server.",
        "A concrete requested change and a connection with trakt:write; pass confirmed: true only for that intent. Reauthorize older read-only connections through client OAuth; refresh and device login cannot increase scope."
      ],
      "expected_behavior": "Resolve the movie and list target, create the requested private list, add the returned Trakt ID only with write authorization, then read back the requested change. Public list discovery does not authorize edits.",
      "sources": [
        {
          "path": "plugins/trakt-mcp/skills/lists-and-watchlist/SKILL.md",
          "format": "markdown",
          "mode": "section",
          "heading_path": [
            "Lists and watchlist"
          ]
        },
        {
          "path": "docs/pages/skills.html",
          "format": "html",
          "mode": "section",
          "selector": "article#lists-and-watchlist"
        },
        {
          "path": "docs/pages/skills.html",
          "format": "html",
          "mode": "section",
          "selector": "section:nth-of-type(2)"
        },
        {
          "path": "README.md",
          "format": "markdown",
          "mode": "section",
          "heading_path": [
            "API coverage and write access"
          ]
        }
      ],
      "evidence": "documented"
    },
    {
      "id": "skill-upcoming-releases",
      "capability_refs": [
        "skill:upcoming-releases"
      ],
      "title": "Read a bounded calendar",
      "input_or_trigger": "What episodes are on my calendar next week in America/Chicago?",
      "platform": "claude",
      "prerequisites": [
        "Install the plugin or the named standalone skill, and separately enable the Trakt MCP connection. Skills alone do not supply tools or authenticate the server."
      ],
      "expected_behavior": "Resolve the requested dates and time zone, read the personal show calendar for a bounded window, preserve supplied air times, and report incomplete coverage. A calendar is not proof of streaming availability.",
      "sources": [
        {
          "path": "plugins/trakt-mcp/skills/upcoming-releases/SKILL.md",
          "format": "markdown",
          "mode": "section",
          "heading_path": [
            "Upcoming releases"
          ]
        },
        {
          "path": "docs/pages/skills.html",
          "format": "html",
          "mode": "section",
          "selector": "article#upcoming-releases"
        },
        {
          "path": "docs/pages/skills.html",
          "format": "html",
          "mode": "section",
          "selector": "section:nth-of-type(2)"
        }
      ],
      "evidence": "documented"
    },
    {
      "id": "skill-manage-library",
      "capability_refs": [
        "skill:manage-library"
      ],
      "title": "Make a requested library change",
      "input_or_trigger": "Rate Arrival (2016) 8 and add it to my collection.",
      "platform": "claude",
      "prerequisites": [
        "Install the plugin or the named standalone skill, and separately enable the Trakt MCP connection. Skills alone do not supply tools or authenticate the server.",
        "A concrete requested change and a connection with trakt:write; pass confirmed: true only for that intent. Reauthorize older read-only connections through client OAuth; refresh and device login cannot increase scope."
      ],
      "expected_behavior": "Resolve the title before writing. Require a write-enabled connection and explicit requested effects; verify each result by reading state and never replay an uncertain write automatically.",
      "sources": [
        {
          "path": "plugins/trakt-mcp/skills/manage-library/SKILL.md",
          "format": "markdown",
          "mode": "section",
          "heading_path": [
            "Manage a Trakt library"
          ]
        },
        {
          "path": "docs/pages/skills.html",
          "format": "html",
          "mode": "section",
          "selector": "article#manage-library"
        },
        {
          "path": "docs/pages/skills.html",
          "format": "html",
          "mode": "section",
          "selector": "section:nth-of-type(2)"
        },
        {
          "path": "README.md",
          "format": "markdown",
          "mode": "section",
          "heading_path": [
            "API coverage and write access"
          ]
        }
      ],
      "evidence": "documented"
    },
    {
      "id": "skill-connection-help",
      "capability_refs": [
        "skill:connection-help"
      ],
      "title": "Reconnect a Trakt account",
      "input_or_trigger": "Trakt tools are installed, but my account won’t connect.",
      "platform": "claude",
      "prerequisites": [
        "Install the plugin or the named standalone skill, and separately enable the Trakt MCP connection. Skills alone do not supply tools or authenticate the server."
      ],